{
  "name": "missing_caster",
  "description": "The explicit counterpart of the unknown case: this person is declared complete for magic and has none.",
  "packs": [
    "general",
    "core",
    "fantasy"
  ],
  "cast": [
    {
      "id": "clerk",
      "body": "general:body.humanoid",
      "complete_for": [
        "fantasy:magic"
      ]
    },
    {
      "id": "foe",
      "body": "general:body.humanoid"
    }
  ],
  "use": [
    {
      "entry": "fantasy:action.cast_on",
      "bind": {
        "caster": "clerk",
        "target": "foe"
      }
    }
  ],
  "expect": {
    "status": "conflict",
    "because": "The clerk is complete for fantasy:magic and does not provide fantasy:magic.caster, so the requirement is explicitly missing.",
    "detail": {
      "participant": "clerk",
      "capability": "fantasy:magic.caster",
      "state": "absent"
    }
  }
}
