{
  "name": "dragon_rider",
  "description": "A person riding a dragon. Nothing in core mentions dragons.",
  "packs": [
    "general",
    "core",
    "fantasy"
  ],
  "cast": [
    {
      "id": "rider",
      "body": "general:body.humanoid"
    },
    {
      "id": "drake",
      "body": "fantasy:creature.dragon"
    }
  ],
  "use": [
    {
      "entry": "general:position.riding",
      "bind": {
        "rider": "rider",
        "mount": "drake"
      }
    }
  ],
  "expect": {
    "status": "feasible",
    "because": "The dragon inherits quadruped and adds size.huge, which meets the mount's any_of; the rider straddles its back."
  }
}
