{
  "name": "solo",
  "description": "One person standing alone.",
  "packs": [
    "general",
    "core"
  ],
  "cast": [
    {
      "id": "ana",
      "body": "general:body.humanoid"
    }
  ],
  "space": "general:space.floor",
  "use": [
    {
      "entry": "general:position.standing_alone",
      "bind": {
        "person": "ana"
      }
    }
  ],
  "expect": {
    "status": "feasible",
    "because": "The humanoid walks on two legs, the floor gives ground, and the standing posture places the person."
  }
}
