{
  "name": "six_people",
  "description": "Six people kneeling in a ring, each touching the next one's shoulders.",
  "packs": [
    "core"
  ],
  "cast": [
    {
      "id": "p1",
      "body": "core:body.humanoid"
    },
    {
      "id": "p2",
      "body": "core:body.humanoid"
    },
    {
      "id": "p3",
      "body": "core:body.humanoid"
    },
    {
      "id": "p4",
      "body": "core:body.humanoid"
    },
    {
      "id": "p5",
      "body": "core:body.humanoid"
    },
    {
      "id": "p6",
      "body": "core:body.humanoid"
    }
  ],
  "space": "core:space.floor",
  "use": [
    {
      "entry": "core:position.circle",
      "bind": {
        "member": [
          "p1",
          "p2",
          "p3",
          "p4",
          "p5",
          "p6"
        ]
      }
    }
  ],
  "expect": {
    "status": "feasible",
    "because": "Six is within 3-12; member[*] places all six; the ring topology wraps member[i+1], so p6 reaches p1.",
    "detail": {
      "pairs": [
        [
          "p1",
          "p2"
        ],
        [
          "p2",
          "p3"
        ],
        [
          "p3",
          "p4"
        ],
        [
          "p4",
          "p5"
        ],
        [
          "p5",
          "p6"
        ],
        [
          "p6",
          "p1"
        ]
      ]
    }
  }
}
